title,content
<strong>Netherlands nominates World Bank Board Director</strong><br>01 Sep 2023,"On September 1, 2023, the Dutch Council of Ministers mandated the Minister of Finance and Minister for Foreign Trade and Development Cooperation to nominate Eugene Rhuggenaath as the new Executive D... <strong><a href=""https://donortracker.org/policy_updates?policy=netherlands-nominates-world-bank-board-director-2023"" target=""_blank"" rel=""noopener noreferrer"">read more</a></strong>"
"<strong>EU, EIB provide additional US$9 million for education in Ukraine</strong><br>23 Aug 2023","On August 23, 2023, the EIB announced an additional EUR9 million (US$9 million) grant for vocational education in <strong>Ukraine</strong>. The grant was included in the announcement of an EIB col... <strong><a href=""https://donortracker.org/policy_updates?policy=eu-eib-provide-additional-us-9-million-for-education-in-ukraine-2023"" target=""_blank"" rel=""noopener noreferrer"">read more</a></strong>"
<strong>Sweden increases Ukraine support to US$2.4 billion</strong><br>19 Aug 2023,"On August 19, 2023, Swedish Prime Minister Ulf Kristersson hosted Ukrainian President Volodymyr Zelenskyy, the Speaker of the Sweden's parliament, the Swedish Supreme Commander of the Armed Forces, ... <strong><a href=""https://donortracker.org/policy_updates?policy=sweden-increases-ukraine-support-to-us-2-4-billion-2023"" target=""_blank"" rel=""noopener noreferrer"">read more</a></strong>"
<strong>Report recommends Norwegian oil fund international development</strong><br>15 Aug 2023,"On August 15, 2023, a report commissioned by the Norwegian Refugee Council and Save the Children recommended that Norway draw from oil funds to meet humanitarian needs around the globe.  Econom... <strong><a href=""https://donortracker.org/policy_updates?policy=report-recommends-norwegian-oil-funding-for-international-development-2023"" target=""_blank"" rel=""noopener noreferrer"">read more</a></strong>"
<strong>SRID evaluates Japan’s revised Cooperation Charter</strong><br>31 Jul 2023,"On July 31, 2023, the Japan-based Society of Researchers for International Development released its 25<sup>th</sup> journal, which focused on Japan's [recently revised Development Cooperation Charte... <strong><a href=""https://donortracker.org/policy_updates?policy=srid-evaluates-japan-s-revised-cooperation-charter-2023"" target=""_blank"" rel=""noopener noreferrer"">read more</a></strong>"
<strong>Germany pledges U$31 million for sustainable food security</strong><br>25 Jul 2023,"On July 25, 2023, at the UN Conference on Global Food Systems in Rome, Italy, BMZ State Secretary Jochen Flasbarth called for advancements in climate-adapted local agriculture to reduc... <strong><a href=""https://donortracker.org/policy_updates?policy=germany-pledges-u-31-million-for-sustainable-food-security"" target=""_blank"" rel=""noopener noreferrer"">read more</a></strong>"
<strong>Sweden adopts strategy for Ukraine's reconstruction</strong><br>25 Jul 2023,"On July 17, 2023, Sweden pledged SEK6 billion (US$60 million) to a strategic plan for the reconstruction and development of <strong>Ukraine</strong> from 2023-2027, marking its largest ever bilateral aid initiative ... <strong><a href=""https://donortracker.org/policy_updates?policy=sweden-adopts-strategy-for-ukraines-reconstruction-2023"" target=""_blank"" rel=""noopener noreferrer"">read more</a></strong>"
<strong>Italy allocates 60% of bilateral ODA to African partners </strong><br>19 Jul 2023,"The Italian Committee for Development Cooperation at the Ministry of Foreign Affairs adopted a resolution that allocated 60% of all Italian bilateral cooperation resources to African partner countr... <strong><a href=""https://donortracker.org/policy_updates?policy=italy-allocates-60-of-bilateral-oda-to-african-partners-2023"" target=""_blank"" rel=""noopener noreferrer"">read more</a></strong>"
<strong>USAID announces US$495 million in assistance for Ukraine</strong><br>19 Jul 2023,"On July 19, 2023, USAID Administrator Samantha Power announced an additional US$495 million in ODA during a mission to <strong>Ukraine</strong>. USAID allocated US$230 million to support ec... <strong><a href=""https://donortracker.org/policy_updates?policy=usaid-announces-us-495-million-in-assistance-for-ukraine-2023"" target=""_blank"" rel=""noopener noreferrer"">read more</a></strong>"
<strong>Japanese Vice Foreign Minister speaks at UNHLPF</strong><br>19 Jul 2023,"On July 20, 2023, Japanese State Minister for Foreign Affairs Shunsuke Takei spoke on behalf of the Japanese Government at the UNHLPF{title=""UN High-Level Political Forum""} Ministerial Level ... <strong><a href=""https://donortracker.org/policy_updates?policy=japanese-vice-foreign-minister-speaks-at-unhlpf"" target=""_blank"" rel=""noopener noreferrer"">read more</a></strong>"
<strong>South Korea contributes US$10 million for Ukraine reconstruction</strong><br>18 Jul 2023,"On July 18, 2023, South Korean Minister of Economy and Finance Gyeong-ho Choo, who also serves as a Deputy Prime Minister, announced that the South Korean government will contribute US$10 million to... <strong><a href=""https://donortracker.org/policy_updates?policy=south-korea-contributes-us-10-million-for-ukraine-reconstruction-2023"" target=""_blank"" rel=""noopener noreferrer"">read more</a></strong>"
<strong>FCDO releases 43 development partnership strategies</strong><br>17 Jul 2023,"On July 17, 2023, the UK's FCDO released 43 Country Development Partnership Strategies for FY2023-24 and FY2024-25. The CDPS{title=""Country Development Partne... <strong><a href=""https://donortracker.org/policy_updates?policy=fcdo-releases-43-development-partnership-strategies-2023"" target=""_blank"" rel=""noopener noreferrer"">read more</a></strong>"
<strong>JICA President visits Ukraine</strong><br>17 Jul 2023,"On July 17, 2023, JICA President Akihiko Tanaka arrived in <strong>Ukraine</strong> to hold discussions with his Ukrainian counterparts and inspect Japanese assistance in the area. The Japanese governmen... <strong><a href=""https://donortracker.org/policy_updates?policy=jica-president-visits-ukraine"" target=""_blank"" rel=""noopener noreferrer"">read more</a></strong>"
<strong>Canada announces US$449 million in support for Ukraine</strong><br>12 Jul 2023,"On July 12, 2023, Canada announced CAD593 million (US$449 million) in additional support for <strong>Ukraine</strong> as it continues to defend itself against Russia’s illegal invasion. The announcement was mad... <strong><a href=""https://donortracker.org/policy_updates?policy=canada-announces-us-449-million-in-support-for-ukraine"" target=""_blank"" rel=""noopener noreferrer"">read more</a></strong>"
<strong>Japan signs US$98 million ODA loan with Moldova</strong><br>10 Jul 2023,"On July 10, 2023, JICA signed a US$98 million ODA loan with Moldova to support its response to the crisis in <strong>Ukraine</strong>. The loan aimed to help mitigate the effects of the war on Ukr... <strong><a href=""https://donortracker.org/policy_updates?policy=japan-signs-us-98-million-oda-loan-with-moldova-2023"" target=""_blank"" rel=""noopener noreferrer"">read more</a></strong>"
<strong>Briefing note suggests UK abandonment of US$13.9 billion climate finance target</strong><br>04 Jul 2023,"On July 4, 2023, the Guardian newspaper reported that a leaked briefing note to Ministers revealed plans for the UK to abandon its US$13.9 billion (GBP11.6 billion) ICF. The commitment w... <strong><a href=""https://donortracker.org/policy_updates?policy=briefing-note-suggests-uk-abandonment-of-us-13-9-billion-climate-finance-target"" target=""_blank"" rel=""noopener noreferrer"">read more</a></strong>"
<strong>Netherlands delivers second 2023 support package for Ukraine</strong><br>04 Jul 2023,"On July 4, 2023, Minister for Foreign Trade and Development Cooperation Liesje Schreinemacher reported the second support package for <strong>Ukraine</strong> in 2023. The Dutch government will provide another EUR11... <strong><a href=""https://donortracker.org/policy_updates?policy=netherlands-delivers-second-2023-support-package-for-ukraine"" target=""_blank"" rel=""noopener noreferrer"">read more</a></strong>"
<strong>International Prosecution Centre for Ukraine opens in The Hague</strong><br>03 Jul 2023,"On July 3, 2023, the International Centre for the Prosecution of the Crime of Aggression Against <strong>Ukraine</strong> launched its operations at Eurojust in The Hague, the Netherlands. The ICPA{title... <strong><a href=""https://donortracker.org/policy_updates?policy=international-prosecution-centre-for-ukraine-opens-in-the-hague"" target=""_blank"" rel=""noopener noreferrer"">read more</a></strong>"
<strong>Government releases final 2024 budget draft</strong><br>03 Jul 2023,"On July 3, 2023, the German government published its final [budget draft](https://www.berliner-zeitung.de/blz-public/files/2023/07/04/4bb8ee1f-e757-468c-9b0b-5b9cefc63463.pdf) for 2024 and the midte... <strong><a href=""https://donortracker.org/policy_updates?policy=government-releases-final-2024-budget-draft"" target=""_blank"" rel=""noopener noreferrer"">read more</a></strong>"
<strong>Australia pledges additional humanitarian support to Ukraine</strong><br>26 Jun 2023,"On June 26, 2023, Australian Prime Minister Anthony Albanese pledged an additional AUD10 million (US$7 million) for <strong>Ukraine</strong>. The funds were allocated to the <strong>Ukraine</strong> Humanitarian Fund, managed ... <strong><a href=""https://donortracker.org/policy_updates?policy=australia-pledges-additional-humanitarian-support-to-ukraine"" target=""_blank"" rel=""noopener noreferrer"">read more</a></strong>"
<strong>Sweden announces US$35 million in humanitarian assistance for Ukraine</strong><br>26 Jun 2023,"On June 26, 2023, the Ministry for Foreign Affairs of Sweden unveiled a comprehensive humanitarian and recovery support package for <strong>Ukraine</strong>. Valued at SEK380 million (US$35 million), the packag... <strong><a href=""https://donortracker.org/policy_updates?policy=sweden-announces-us-35-million-in-humanitarian-assistance-for-ukraine"" target=""_blank"" rel=""noopener noreferrer"">read more</a></strong>"
<strong>G7 Ministers highlight polycrisis' impact on gender equality </strong><br>25 Jun 2023,"On June 25, 2023, the G7 Gender Equality Ministers met in Tochigi Prefecture, Japan to discuss eliminating the economic disparity between men and women. In the statement, the ministers a... <strong><a href=""https://donortracker.org/policy_updates?policy=g7-ministers-highlight-polycrisis-impact-on-gender-equality-"" target=""_blank"" rel=""noopener noreferrer"">read more</a></strong>"
<strong>Canada provides US$15 million climate finance for Ukraine</strong><br>22 Jun 2023,"At the <strong>Ukraine</strong> Recovery Conference in London on June 21-22, 2023, Canadian International Development Minister Harjit Sajjan announced that Canada will provide a technical assistance grant valued at ... <strong><a href=""https://donortracker.org/policy_updates?policy=canada-provides-us-15-million-climate-finance-for-ukraine"" target=""_blank"" rel=""noopener noreferrer"">read more</a></strong>"
<strong>Germany provides US$416 million for Ukraine reconstruction</strong><br>21 Jun 2023,"At the <strong>Ukraine</strong> Recovery Conference in London on June 21-22, 2023, German Foreign Minister Analena Baerbock announced that Germany will support <strong>Ukraine</strong> with EUR381 million (US$416 million) in humanit... <strong><a href=""https://donortracker.org/policy_updates?policy=germany-provides-us-416-million-for-ukraine-reconstruction"" target=""_blank"" rel=""noopener noreferrer"">read more</a></strong>"
<strong>G7 establishes clean energy partnership with Ukraine</strong><br>21 Jun 2023,"On June 21, 2023, the G7+ Coordination Group established a clean energy partnership with <strong>Ukraine</strong> at a meeting in London. In response to Russia's war against <strong>Ukraine</strong>, G7+ partners... <strong><a href=""https://donortracker.org/policy_updates?policy=g7-establishes-clean-energy-partnership-with-ukraine"" target=""_blank"" rel=""noopener noreferrer"">read more</a></strong>"
<strong>UK announces additional US$624 million for Ukraine; US$3 billion in World Bank guarantees </strong><br>21 Jun 2023,"On June 21, 2023, at the <strong>Ukraine</strong> Recovery Conference hosted by the UK in London, UK Prime Minister Rishi Sunak committed to providing an additional US$3 billion of guarantees to unlock World Bank le... <strong><a href=""https://donortracker.org/policy_updates?policy=uk-announces-additional-us-624-million-for-ukraine-us-3-billion-in-world-bank-guarantees-"" target=""_blank"" rel=""noopener noreferrer"">read more</a></strong>"
<strong>EU Commission proposes MFF revisions</strong><br>20 Jun 2023,"On June 20, 2023, the EU Commission released a proposal for measured increases under several headings of the MFF, the bloc's guiding fiscal document. Citing unexpected challenges ... <strong><a href=""https://donortracker.org/policy_updates?policy=eu-commission-proposes-mff-revisions"" target=""_blank"" rel=""noopener noreferrer"">read more</a></strong>"
<strong>Japan pledges US$5 million for flood response in Ukraine</strong><br>20 Jun 2023,"On June 20, 2023, the Government of Japan announced a US$5 million donation to <strong>Ukraine</strong> to respond to the flood disaster. The funds were allocated to address access to food, water and sanitation... <strong><a href=""https://donortracker.org/policy_updates?policy=japan-pledges-us-5-million-for-flood-response-in-ukraine"" target=""_blank"" rel=""noopener noreferrer"">read more</a></strong>"
<strong>Norad to manage Norwegian Nansen program </strong><br>09 Jun 2023,"On June 9, 2023, the Norwegian Ministry of Foreign Affairs announced that Norad would assume management of the Nansen Plan for <strong>Ukraine</strong>. The Nansen program was launched in February 2023 t... <strong><a href=""https://donortracker.org/policy_updates?policy=norad-to-manage-norwegian-nansen-program-"" target=""_blank"" rel=""noopener noreferrer"">read more</a></strong>"
<strong>Italy approves US$71 million ODA package</strong><br>09 Jun 2023,"On June 9, 2023, Italy's Joint Committee for Development Cooperation approved EUR66 million (US$71 million) worth of projects for partner countries. African partners comprised the main regional... <strong><a href=""https://donortracker.org/policy_updates?policy=italy-approves-us-71-million-oda-package"" target=""_blank"" rel=""noopener noreferrer"">read more</a></strong>"
<strong>Netherlands provides supplies for Ukraine flood zones</strong><br>08 Jun 2023,"On June 8, 2023, Dutch Minister of Foreign Trade and Development Cooperation Liesje Schreinemacher announced that the Netherlands will send aid and rescue equipment to the area in <strong>Ukraine</strong> affected b... <strong><a href=""https://donortracker.org/policy_updates?policy=netherlands-provides-supplies-for-ukraine-flood-zones"" target=""_blank"" rel=""noopener noreferrer"">read more</a></strong>"
<strong>Sweden opens trade office in Ukraine</strong><br>25 May 2023,"On May 25, 2023, Sweden's government announced the opening of a trade office in <strong>Ukraine</strong>. The decision to establish a presence in <strong>Ukraine</strong> highlighted Sweden's commitment to supporting economic d... <strong><a href=""https://donortracker.org/policy_updates?policy=sweden-opens-trade-office-in-ukraine"" target=""_blank"" rel=""noopener noreferrer"">read more</a></strong>"
"<strong>Meloni prioritizes Ukraine, African partners for 2024 Italian G7 presidency</strong><br>21 May 2023","On May 21, 2023, at the G7 summit in Hiroshima, Italian Prime Minister Giorgia Meloni announced that the G7 leaders summit in 2024 would be held in Italy's southern region of Puglia.... <strong><a href=""https://donortracker.org/policy_updates?policy=meloni-prioritizes-ukraine-african-partners-for-2024-italian-g7-presidency"" target=""_blank"" rel=""noopener noreferrer"">read more</a></strong>"
<strong>G7 leaders pledge additional US$4.5 billion for food security</strong><br>20 May 2023,"On May 20, 2023, the G7 pledged to provide an additional US$4.5 billion for food security. The pledgfe was made to continue the fight against the global food crisis under the Global Alli... <strong><a href=""https://donortracker.org/policy_updates?policy=g7-leaders-pledge-additional-us-4-5-billion-for-food-security"" target=""_blank"" rel=""noopener noreferrer"">read more</a></strong>"
<strong>World Bank approves Crisis Facility for Ukraine</strong><br>19 May 2023,"On May 19, 2023, the World Bank's Board of Executive Directors approved a new Crisis Facility for the International Development Association, intended to support <strong>Ukraine</strong>, Moldova, and other countries... <strong><a href=""https://donortracker.org/policy_updates?policy=world-bank-approves-crisis-facility-for-ukraine"" target=""_blank"" rel=""noopener noreferrer"">read more</a></strong>"
<strong>Council of Europe establishes Ukraine War Damage Register in The Hague</strong><br>17 May 2023,"On May 17, 2023, the Council of Europe established a registry for damage resulting from the war in <strong>Ukraine</strong> at a summit held in Reykjavik. The Damage Register was established within the Council’... <strong><a href=""https://donortracker.org/policy_updates?policy=council-of-europe-establishes-netherlands-ukraine-war-damage-register"" target=""_blank"" rel=""noopener noreferrer"">read more</a></strong>"
<strong>EU's von der Leyen shares priorities for Hiroshima Summit</strong><br>15 May 2023,"On May 15, 2023, European Commission President Urusla von der Leyen released a statement outlining the bloc's priorities for the Hiroshima Summit. Foremost, von der Leyen highlighted <strong>Ukraine</strong> as... <strong><a href=""https://donortracker.org/policy_updates?policy=eus-von-der-leyen-shares-priorities-for-hiroshima-summit"" target=""_blank"" rel=""noopener noreferrer"">read more</a></strong>"
<strong>Norwegian CSOs criticize proposed 2023 Revised State Budget reallocations</strong><br>11 May 2023,"On May 11, 2023, the Norwegian government presented its revised state budget for 2023. In the budget, the government proposed a record high allocation to international development of NOK58.5 bi... <strong><a href=""https://donortracker.org/policy_updates?policy=norwegian-csos-criticize-proposed-2023-revised-state-budget-reallocations"" target=""_blank"" rel=""noopener noreferrer"">read more</a></strong>"
"<strong>Trudeau announces trip to Republic of Korea, Japan</strong><br>10 May 2023","On May 10, 2023, Canadian Prime Minister Justin Trudeau announced that he will travel to the Republic of Korea from May 16-18, 2023 for an official bilateral visit, and to Japan from May 19-21, 2023... <strong><a href=""https://donortracker.org/policy_updates?policy=trudeau-announces-trip-to-republic-of-korea-japan"" target=""_blank"" rel=""noopener noreferrer"">read more</a></strong>"
<strong>Norad data show record high funding towards international development in 2022 </strong><br>09 May 2023,"On May 9, 2023, Norad released data showing that Norway allocated a record high amount of funding to international development in 2022. In 2022, Norway spent NOK49.6 billion (US$4.7 bill... <strong><a href=""https://donortracker.org/policy_updates?policy=norad-data-show-record-high-funding-towards-international-development-in-2022-"" target=""_blank"" rel=""noopener noreferrer"">read more</a></strong>"
<strong>Spain's Sánchez highlights SDGs in meeting with UN Secretary General</strong><br>08 May 2023,"On 8 May, 2023, Spain’s Prime Minister Pedro Sánchez met at La Moncloa, Madrid, with UN Secretary General António Guterres. The leaders discussed global challenges such as climate change... <strong><a href=""https://donortracker.org/policy_updates?policy=spains-sanchez-highlights-sdgs-in-meeting-with-un-secretary-general"" target=""_blank"" rel=""noopener noreferrer"">read more</a></strong>"
<strong>Swedish development minister outlines priorities for 2023</strong><br>04 May 2023,"On May 4, 2023, Swedish Minister for International Development Johan Forssell published an article in the Dagen Daily outlining Sweden's ODA priorities. Co-written with Gudrun Brunegård,... <strong><a href=""https://donortracker.org/policy_updates?policy=swedish-development-minister-outlines-priorities-for-2023"" target=""_blank"" rel=""noopener noreferrer"">read more</a></strong>"
<strong>Netherlands expresses continued support Ukraine</strong><br>04 May 2023,"On May 4, 2023, Dutch Minister of Foreign Affairs, Wopke Hoesktra expressed the Netherlands’ continued support for <strong>Ukraine</strong> against Russia’s illegal invasion with weapons, humanitarian aid, reconstru... <strong><a href=""https://donortracker.org/policy_updates?policy=netherlands-expresses-continued-support-ukraine"" target=""_blank"" rel=""noopener noreferrer"">read more</a></strong>"
<strong>Netherlands publishes 2023 Spring Budget; US$615 million ODA reallocated to host asylum seekers</strong><br>26 Apr 2023,"On April 26, 2023, Dutch Minister of Finance Sigrid Kaag presented the *Spring Budget*. This budget provides an update on the government’s 2023 budget and outlines what could be expected for the 202... <strong><a href=""https://donortracker.org/policy_updates?policy=netherlands-publishes-2023-spring-budget-us515million-oda-reallocated-to-host-asylum-seekers-"" target=""_blank"" rel=""noopener noreferrer"">read more</a></strong>"
<strong>Italy donates US$110 million to EU for Ukraine initiative</strong><br>26 Apr 2023,"On April 26, 2023, at the bilateral conference on <strong>Ukraine</strong> reconstruction, Italy announced a commitment of US$110million (EUR100 million) to the EIB trust fund for reconstruction and recovery... <strong><a href=""https://donortracker.org/policy_updates?policy=italy-donates-us-110-million-to-eu-for-ukraine-initiative"" target=""_blank"" rel=""noopener noreferrer"">read more</a></strong>"
"<strong>Canada, Japan agree to cooperate on global food security </strong><br>24 Apr 2023","On April 24, 2023, the Canadian Minister of Agriculture and Agri-Food Marie-Claude Bibeau, and the Japanese Minister of Agriculture, Forestry, and Fisheries Nomura Tetsuro, released a joint statemen... <strong><a href=""https://donortracker.org/policy_updates?policy=canada-japan-agree-to-cooperate-on-global-food-security-"" target=""_blank"" rel=""noopener noreferrer"">read more</a></strong>"
<strong>Japan donates US$471 million for Ukraine relief efforts</strong><br>21 Apr 2023,"On April 21, 2023, Japan donated US${title=""US$ amounts for funding are reported using the currency conversion provided by the relevant organization at the time the pledge was made.""}471 millio... <strong><a href=""https://donortracker.org/policy_updates?policy=japan-donates-us-471-million-for-ukraine-relief-efforts"" target=""_blank"" rel=""noopener noreferrer"">read more</a></strong>"
<strong>Dutch Special Envoy for Business and Reconstruction of Ukraine resigns</strong><br>20 Apr 2023,"On April 20, 2023, Dutch Minister for Foreign Trade and Development Cooperation Liesje Schreinemacher announced that Ron van Dartel, assigned as the Special Envoy for Business and Reconstruction Ukr... <strong><a href=""https://donortracker.org/policy_updates?policy=dutch-special-envoy-for-business-and-reconstruction-of-ukraine-resigns"" target=""_blank"" rel=""noopener noreferrer"">read more</a></strong>"
<strong>BMZ increases support to Ukraine by US$119 million</strong><br>19 Apr 2023,"On April 18 and 19, 2023, the parliamentary state secretary at the BMZ, Jochen Flasbarth, met with high-level representatives of the Ukrainian government in Kiev to discuss support for the re... <strong><a href=""https://donortracker.org/policy_updates?policy=bmz-increases-support-to-ukraine-by-us-119-million"" target=""_blank"" rel=""noopener noreferrer"">read more</a></strong>"
<strong>Norway allocates US$36 million for green emergency assistance </strong><br>17 Apr 2023,"On April 18, 2023, Minister of International Development Anne Beathe Tvinnereim, Norad DIrector General Bård Vegar Solhjell, and NRC{title=""Norwegian Refugee Council""} Jan Egeland, si... <strong><a href=""https://donortracker.org/policy_updates?policy=norway-allocates-us-36-million-for-green-emergency-assistance-"" target=""_blank"" rel=""noopener noreferrer"">read more</a></strong>"
